,Tweet Id,Tweet
301,1559780704917098497,family finds several bodies stuffed in cases at unit they won in storage wars style auction sparking serial killerfears 
302,1559780695504986113, if the divine appointment of the prophet s is established then the prophet s appoints his successor a series of appointments follow from there this is the shia view of khilafah imamah which is more logical and coherent
303,1559780687351275521, good morning
304,1559780685145071616, get well soon 
305,1559780681831563267, open challenge for all muslims name the pakhtun sahabi 
306,1559780673380040704,weather in islamabad 
307,1559780664475516930,iraqs firebrand shiite cleric moqtada sadr backtracked after earlier urging his supporters to join a massive rally read here 
308,1559780649032097792, its getting tougher by the day to avoid getting embarrassed in this setup 
309,1559780642430361602,my favorite person only in the world 
310,1559780638605066240,assalamo alaikum good wali morning friends happy wednesday khush rahain abad rahain 
311,1559780625749606400, good morning
312,1559780615871938562, you know whos the most amazing person in the world read the first word
313,1559780613464461317, morning 
314,1559780611753222144, stay blessed 
315,1559780606514548738, my favorite person only in the world 
316,1559780598453002240, why muslim world doing nothing just condolences and take dollars from israel supported us
317,1559780596628480002, congrats
318,1559780594007134209, deserves respect for taking the right decisions by following the set formula and protocol amp not compromising national interests over political gains although has her own political stature amp opinions she should not interfere in portfolio
319,1559780585605926912, have a good day
320,1559780580971188224,please 
321,1559780576613351424," hii
what is up"
322,1559780573471703040, these cats want apology 
323,1559780563434758146,just posted a photo new york u s a 
324,1559780549400711168,same here father robolex mother netflix 
325,1559780548075298816, he is tax payer uk good gives respect him 
326,1559780547416702976, not on air in dist bahawalnagar
327,1559780544690413568, done
328,1559780541586481152,today i came on conclusion that hmry govt officials ko khak b nhi pta 
329,1559780541150412800,it seems like mufti sb always know what kind of advice we need 
330,1559780534330482689, mery pas time nhi hota
331,1559780532287950848, great 
332,1559780531147005953, lol feeling bad for ya
333,1559780529758736384, nadeem sb you had great respect earlier but ab ap rco kay moharay sabit huyea hain
334,1559780526327844864,let is a poll will you come out to support dr shahbaz gill if he is delayed or denied justice share it with your friends to raise voice imported govt must take note 
335,1559780526051008513, beautiful
336,1559780523412754432,"cash counting machine
model no automatic detection with uv and mg while counting
contact us uan "
337,1559780521382744064, they arent
338,1559780518102810626, honestly
339,1559780515900702721, stay blessed 
340,1559780515275743232, dollor nhi oil rates km hoe he mgr mian sahib ne petrol ke prices increase krdye 
341,1559780514717990915, view beautiful 
342,1559780514223079426, oh please you may make billions more if you pull this off 
343,1559780512167772163, good morning 
344,1559780499111002112,indeed a bad news its may he be awarded with best of health amp golf fortune prayers amp thoughts with her 
345,1559780492551110656, joker
346,1559780491540283393, hello how are you
347,1559780480584744961, hahaha exactly bdw i must appreciate ur observation strength here 
348,1559780472066039809,order of union awarded to emile lahoud prince salman bin hamad al khalifa the prince philip prince willem alexander mr bill gates and sergey lavrov coas medals already awarded 
349,1559780470849667072,the world is headed toward disasters in every aspect
350,1559780451329495042, i wish
351,1559780446325673984,i can still see people arguing keh result bajay aay ga yeh bajay 
352,1559780439891791872, ok but what about you 
353,1559780438561923076, pls be fake news i can not afford to hate miftah yet 
354,1559780437928693761,i wish i could honey 
355,1559780436112510979,heal inspire and revive 
356,1559780430315937792, im almost done with uni gurl its all a lie 
357,1559780428118122500, noted sir 
358,1559780427614797826,being an ordinary pakistani i feel an air full of fear despair panic and gloom around me the decision makers consider my land their chessboard and play violent moves and do not bother our sentiments is there any door we should knock at to get relief 
359,1559780425496764416, thank you 
360,1559780424590786560, god bless you 
361,1559780420291543041,covid statistics august total tests in last hours positive cases positivity deaths patients on critical care 
362,1559780414348316675,maralee nichols shades tristan thompson again amid child supportbattle 
363,1559780412184043522,frankly it depends from person to person like for nargis and people like that the explanation of vulgarity is way different from the middle class in high classes specially media industry they perceives things normal which middle class takes as vulgar 
364,1559780399164915712, jazak allah sir hope it will be completed on urgent basis
365,1559780398498029569,this is everything we need to boost our skills confidence international clients are amazing they provide opportunity they wait for you to put your best they do not forget to give you a reward tip paid 
366,1559780398183358464, bs award py hi khush hty rehna
367,1559780394953854976, fuzool
368,1559780388578418688, that is so obvious mf 
369,1559780385130745856,okay pindi keep going 
370,1559780379866939392, good morning
371,1559780377677500416, please comment
372,1559780377316794368, welcome
373,1559780372732227584, over my dead body
374,1559780368554889217, wslam morning 
375,1559780366235344897, listen komal if life gives you a chance be a doctor or teacher not cricket journalist or expert 
376,1559780358400479232, same here
377,1559780357876097026, sab is one of the most impressive sports analysit in our cricket fraternity and sports shows 
378,1559780345905545216, some people still wonder why messi runs horizontally sometimes they have never seen assists like these actually 
379,1559780324229480449, morning
380,1559780318944583681," light up the pink
i bring the pain like
pink venom mv teaser "
381,1559780311764017153, eak dafa inka kera mar he lyna du but i am afraid it would not
382,1559780306202365952," w salaam
good morning sweetie "
383,1559780305485152256,mosam 
384,1559780303585034241, o get well soon brother 
385,1559780300741398532, bro she just threw you under the bus dm her to delete this imo 
386,1559780297910231045,the only viable solution to the present state of affaires is to call an all political parties inc pti roundtable conference by the president of pakistan the apc should have a clear agenda of conducting gen elections elec reforms in govt etc 
387,1559780292356874240, good morning 
388,1559780284731740164, dear customer complaint is noted and forwarded to concerned sdo 
389,1559780283418820608, dont agree
390,1559780281040736256, exactly right
391,1559780279916576768, as if he would listen to your advice 
392,1559780270315806723, good morning
393,1559780268059287553, morning
394,1559780267098722304,gen z and me 
395,1559780259272204295,i think is the most under rated journalist loved his style of journalism always 
396,1559780259205189632, same to u
397,1559780255728128004, fb plz 
398,1559780243082190849, exactly
399,1559780241421131778, may we never run out of good energy lt 
400,1559780236018974720,this is 
401,1559780236006461441, huge winning project
402,1559780234953719812, still same 
403,1559780230763520000, keep shining and rocking
404,1559780223780102151, one of the biggest and wonderful most beautiful mosque in the world allah pak masjid e nabwi ho hamasha abad rakhy ameeeen 
405,1559780223624806400,rejections make you istronger not weaker 
406,1559780223327125505,who is christi dembrowskis husband 
407,1559780221452263425, whites are hot
408,1559780221183721472,if you know you know
409,1559780217836736515, mafroor ishtihaari corrupt legally incompetent exactly wo kiu betha ijlaas m kis n osko pakistan k legal affairs m interfere hony ki perm did democratic state h lihaza hm awam n to ni di why 
410,1559780211071270913, a very interesting perspective however chancellor olaf is a democratically elected leader who belongs to the centre or centre left sdp pres macron is also a democratically elected leader belonging to a liberal political party 
411,1559780210689642497, keep shining and rocking
412,1559780210089906181,calm in life 
413,1559780203504832512, good morning
414,1559780200031846400, dear customer your complaint is noted and forwarded to concerned sdo 
415,1559780199453032451, i meant asal wala shadab khan bro 
416,1559780197313945601, kamisama kiss ahhhhhhhhh my favourite rom com anime 
417,1559780197033021440,here are the latest updates on cases in for more details amp 
418,1559780196714254337, i join daily to learn and earn tokens download and join me 
419,1559780196626178049,female student kidnapped sexually harassed in faisalabad 
420,1559780194537316352, english again 
421,1559780193597902848, keep shining and rocking
422,1559780191672713217, why thank god for guli
423,1559780191005806594, the holy quran amp the life of holy prophet pbuh has outlined basic principles of islamic political system amp the structure was left for the man is reason amp wisdom to decide upon with changing times amp circumstances 
424,1559780179483967489, why not mentioning businessman is name must be exposed
425,1559780175310721025, keep shining and rocking
426,1559780172865458178, english please 
427,1559780163444932614,just posted a photo 
428,1559780161712685056,investors from oman have expressed their keen interest in investment in pakistans railway infrastructure development amp power projects al anvwar asian investments expressed their interest in the construction of a kilometer long rail track from gwadar to jacobabad sindh
429,1559780160794140672, keep shining and rocking
430,1559780156671234048,replace india with south asia and it is fits 
431,1559780155274444801, glory to god
432,1559780152359485441, everyday is a sad day 
433,1559780141462700032, congratulations 
434,1559780137410895873, keep shining and rocking
435,1559780136236580864, love from pakistan
436,1559780133891891202," mubarak
many more to come in sha allah"
437,1559780131857743872, good morning
438,1559780127243964418, morning 
439,1559780124245082115,arshad sharif welcome youtube chanil 
440,1559780115072131072,good morning after throwing up breakfast
441,1559780110047318016, keep shining and rocking
442,1559780109090955264, thanks for correction i tagged wrong id 
443,1559780108516335616, kesy
444,1559780107765649409,"proposed to someone no
broke someones heart maybe stalked someone here no
went to a restaurant alone no
went for a movie alone no
made a prank call no
wrote a poem yes
ran in rain yes
got beatings from a teacher yes
had a crush on a teacher no "
445,1559780106880667648,attended competitive trading amp bilateral contracts market at headquarters islamabad on aug had an interactive post session discussion with the officials 
446,1559780105873940480, ghobi hy ye to
447,1559780101134360576, i have always participated in these competitions but never won anything would love if i could get this pc 
448,1559780098470993925, keep shining and rocking
449,1559780096222941184,on point i believe if we can not find any we need to become one first 
450,1559780096164216835, match main us ky wickets hai
451,1559780095438557190, i m good and you
452,1559780089939869697, happy independence
453,1559780089562284032, keep shining and rocking
454,1559780086433271808, she is a pedo because it is a horrible thing to day and she said it anyway if someome said or years i want to kill jews whether he is convicted or not he is an anti semite 
455,1559780086324215808, though i really am loosing hopes about the story and the fact that this will work still i will do it why leave a chance to rant lets pour our frustations out 
456,1559780083870703616,together work in all paletfom should the leadership 
457,1559780083166072832, after being pm of pakistan for three times this is what he had to face everytime those who choose money and power over nation building will be tried the same way as this woman is asking him to come out and answer the questions a great shame for ns 
458,1559780082163630080,some us states and mexico must cut their water usage to avoid a catastrophic collapse of the colorado river washington officials said as a historic drought bites read here 
459,1559780080901029889, good night 
460,1559780079009513473, you are right
461,1559780074307608576,torture to shahbaz gill is unacceptable international human rights organisations should play their part against this brutal torture with shahbaz gill in pakistan 
462,1559780073611345921, keep shining and rocking
463,1559780067273760769,karachi desperately needs lg elections ex ag tells sc 
464,1559780066791510016,pti leader hammad azhar said the federal governments debt under pml n rule has risen to rs trillion in just four months but no headlines in papers thats the power of advertising 
465,1559780066057396225, test case for pti government in punjab
466,1559780064253837314, always welcome murshed 
467,1559780059719892992,arrest him 
468,1559780052363010053,university of sialkot is proud to announce another addition to its postgraduate programs we have acquired the noc of phd english amp linguistics admissions open fall visit main campus or visit our website for more information 
469,1559780050391781376, done 
470,1559780048323870720, receive i receive apki din sy sim band hai we are not same dear 
471,1559780041399091200, good morning
472,1559780035753656321,mivida city balloting and possession ceremony august mivida sprin via 
473,1559780032133873666, done 
474,1559780030439456769,any doubts about which foreign forces brought imran khan in to destabilise pakistan and what a good job he has done for his masters 
475,1559780030355488770, shame on you 
476,1559780021111250951, keep shining and rocking
477,1559779999795892224, received views from youtube pakistan on august 
478,1559779998890082304,good 
479,1559779990681567234, cheesecake
480,1559779988982857731, good morning
481,1559779986608906240, haha nhe actually i meant k book parhne se neend ajati ha foran is lea 
482,1559779986365612034, great initiative we hope that recruitment process will be accomplished within no time 
483,1559779983631044608, done 
484,1559779983521898500, congrats
485,1559779981089275904, very sad news rip 
486,1559779981059923969,aviation update 
487,1559779978727886848, plz verify the account of sab we want blue tick in front of his name 
488,1559779973455663104,which one are you sunrise or sunset i love sunsets gt gt gt gt gt gt gt 
489,1559779966979641345, thank you sir 
490,1559779961724092416, they should leave pakistan and leave the country to these people as its their inheritance as corrupt generals corrupt judiciary bureacrates and two face society its useless to look at this system for justice and implementation of law
491,1559779960453308416, no i am double
492,1559779952412790785, so sad 
493,1559779946519830529, good morning
494,1559779945156673538, do you even know what is homophobia 
495,1559779941755064322,cyber i us offers reward up to million for information about the conti gang
496,1559779935862005760,just posted a photo new york u s a 
497,1559779935140696064,sir your kind attention for notice speedy trial and punishment is required persons are arrested but shall not be released prosecution favour if can be granted 
498,1559779934603804677, maybe he want to become your friend
499,1559779934549282816,president uae sheikh mohammed bin zaid alnehan presenting prestigious of union to coas bajwa this award in past has been awarded to prince williams prince philips bill gates sargai lavrouv 
500,1559779933228093441,differentiate between good and bad woman
0,1558956817799348224, she is shilling so hard for that white boy when he is just cringe megan is really trash 
1,1558956812728164353, cuz u fantasizing my lil bro
2,1558956780545351681,question of the day 
3,1558956779274371074,guys this is nonsense and unappreciated do not drag people is families especially kids please 
4,1558956778162978816, are not you the na foreign affairs committee chief in the present government under the you have lost the right to speak about anything let alone the balochi people while you are part of the polishing club
5,1558956744562429952, stretching check karo is weight pe 
6,1558956729953574913, fav madrid player 
7,1558956685917560832,that shark game 
8,1558956685456203777, ignoring is the best revenge
9,1558956665822711808, it was not even a family program btw and you the prime minister of islamic republic of pakistan appreciating the most ashamed independence day celebration with that much courage 
10,1558956661900906497, respect
11,1558956643081228288,schiff says hes seen no evidence that trump declassified documents found at mar a lago 
12,1558956637490135040,for the ppl who bless my tl everyday 
13,1558956624684924928, this is hilarious 
14,1558956619798650880,may god bless you and bring more happiness and success to your life happy birthday to you 
15,1558956601473630209, good morning
16,1558956542422126597, you have played such great knock azhar ali salman agha imam abdullah should learn from you well done brother you did exceptionally well 
17,1558956539825758209, good morning
18,1558956536487108610, what happen on this time 
19,1558956515859599363,nehru and mountbatten collaboration is confirmed nehru saw the secret documents partition date was june but mountbatten hastened it to august hence very poor preparation amp million deaths has tried to balance it 
20,1558956503427604485, the people you just addressed i also want to ask them is it our culture custom or is it what we meant for freedom 
21,1558956492346327041,brooklyn and nicola peltz seemingly add to victoria beckhams worries with new steamysnaps 
22,1558956490081312771, so the only way to respond is with freedom of action 
23,1558956484188307457, congratulations 
24,1558956469663535106, wassay bhaai very poor movie or apki acting soo soo sad to see puri movie main apko lag raha thaa guy ka cracter diya ha hamyon saeed perform not well perfoem kiya karta story ma hi jaan nhai thii punjab nhai jaon gi far better then this
25,1558956451451772929,mandy moore showcases elegant pregnancy style as shes honored at hca tv awards tifnews 
26,1558956421936566273, it is the final countdown huh let is see 
27,1558956411429740544,uzma bukhari v who is gonna win the match an interesting match is going in midnight on twitter and i am enjoying it 
28,1558956402886025216, mein sadqay onna tay 
29,1558956389829066752,this picture was taken on the of august first guard of honour to the governal general of pakistan mr mohammad ali jinnah where pakistan is national flag was mounted with panja e maula ghazi abbas on the top 
30,1558956385823588353,wheres this music from 
31,1558956347693178881, no problem it happens
32,1558956303434715137, idk what is the point of hatred this guy is showing love for his country with beautiful skill appreciate it or leave everyone knows we are all completely gross stop fantasizing and glorifying your stories pakistan abaad rahe 
33,1558956284724011008,understand the sentiment but feel like saying this was pretty unnecessary you say you dont mean to invalidate those who have these sentiments but phrase it as if youre annoyed by them 
34,1558956274083053568,guys claim asap 
35,1558956254587928577, you can not compare the status of your parents with that of prophet mohammad pbuh ahmad noorani is a total noob and lacks the knowledge on the subject matter it does not matter what he thinks so do not give importance to opinion of every tom dick and harry
36,1558956231317929986, answer please 
37,1558956191488921600,it is am and i have been watching bts interviews since am 
38,1558956185381994496,workers going into office just days a week surveysuggests 
39,1558956183628775426, ok thanks for the information 
40,1558956160199413760,do not try to hold back laughter via 
41,1558956157363961859,lg plans to introduce inch oled panels thisyear 
42,1558956142382006273,china and pakistan reluctant to fight terrorism balwan nagial the blogs 
43,1558956108336726017,great gesture by 
44,1558956107548266498,safaree and kimbella twitter video safaree kimbella viral video safaree and kimbella leaked video 
45,1558956106701049859, just enjoy and ignore her spokes person of pmln 
46,1558956070629957634,it was like yesterday 
47,1558956064858689542, deal with this guy please
48,1558956059234115584, let is focus on smt because ain kai liya lkahon batien hosakti hai or adeel bhai bhi hongain kal it is a big space tomorrow
49,1558956020491231236, btc news 
50,1558956017408434176,happy independence day 
51,1558956017169432576, in a few months i think time is not real 
52,1558955989386362882, yeah yeah
53,1558955985049378821, i love you more hoor meri jaan
54,1558955983593955329, btc news 
55,1558955972755873792, the thing is if you truly believe in something stay true to it work hard and never give up then no matter what the circumstances are you will succeed also if you change the way you think you change the world around you 
56,1558955954162507777, so jao
57,1558955938119311360, would love to chat with you about this story some day 
58,1558955924793991169, stop wasting time with a joker who thinks talking against military leadership political interference and bringing thugs like nawaz in power is somehow anti army in reality he is anti army
59,1558955890581147649, point
60,1558955889712922626, imran bhai video upload krain please 
61,1558955883362672640, good
62,1558955871912312832, thanks love canada 
63,1558955868502347777,i havent left the house in ten days im unable to sleep always annoyed and angry i feel like i dont have any energy left to fix it anymore 
64,1558955866686193666,surviving
65,1558955864261906432, congratulations 
66,1558955860986044419, and general faiz out
67,1558955857613914116, he has bad taste i cant 
68,1558955842678013952, your outfits are out of this world 
69,1558955829277212673,this is so cute 
70,1558955821949718532,mera desh mere jan i love my pakistan 
71,1558955818095181829, well deserved
72,1558955757101539329, there are only women in the world that know how to dress megan olivi vera farmiga
73,1558955756786958336, do not check your dms you might see your address ip hardware id social security your pick ems your diet plan
74,1558955750596255752, pierching how painful it is 
75,1558955734611775488,adobe premiere pro crack tutorial download premiere pro version free new crack link password adobe premiere pro is the leading video editing software for film tv and the web creative tools integration with other ado 
76,1558955717805178887,adobe after effects crack free download ae full version august link password with adobe after effects the industry standard motion graphics and visual effects software for windows pc you can take any ide 
77,1558955714995015683, happy august 
78,1558955709592633344, keep smiling and keep singing also do not forget to sing a ghazal some day soon 
79,1558955701615091712,sony vegas pro crack full version sony vegas free download link password vegas pro is your project companion from start to finish edit professional video and audio material in high resolution formats up 
80,1558955686901563392, sketchup pro free download crack sketchup sketchup pro link password sketchup pro is the most intuitive way to design document and communicate your ideas in it is a modeling compute 
81,1558955673370648579,who changes monkeypox variant names linking it to africa complete name change on the cards tifnews 
82,1558955666483691530,adobe lightroom crack install free download update fix tutorial august repack link password adobe photoshop lightroom gives you everything you need to edit organize store and share your photos acros 
83,1558955655964360705,balochistan levies force lady constables contingent during august parade 
84,1558955652533424130,at the end of the day i just wanna be loved properly
85,1558955649182089221,adobe illustrator crack adobe illustrator free download illustrator crack link password adobe illustrator is the industry standard vector graphics software for windows pc that lets you create logos icons drawin 
86,1558955643293384706,the reach 
87,1558955638994132993,india is anniversary modi is proving pakistan is case for partition 
88,1558955631448662017,adobe audition install tutorial activation adobe audition crack version free download link password adobe audition is a comprehensive toolset that includes multitrack waveform and spectral display for crea 
89,1558955620568649728, thanks ily bro
90,1558955619624837121,animate crack adobe animate free download new version august link password with adobe animate you can design interactive vector and bitmap animations for games apps and the web bring cartoons and banne 
91,1558955591871127553, turner wins 
92,1558955590872973312, this should be the best one then 
93,1558955551912071169, we love you and stand with you 
94,1558955549491961856, fact facebook ads are used by of marketers and there were million active advertisers on the platform in social media examiner statista 
