,Tweet Id,Tweet
95,1558955545939378176,daily use of multivitamins not beneficial for health study 
96,1558955545381552129,in modern civil services of pakistan how many grades of services exist a b c d lt more gt 
97,1558955539916361731,"the time period of f w taylor was influenced by a industrial revolution
b agrarian revolution
c social revolution
d scientific revolution lt more gt "
98,1558955533557633024,in which of the following year herbert simon got nobel prize a b c d lt more gt 
99,1558955532513419265, good
100,1558955529367478272,"position description is a written document of the duties responsibilities and covering titles of a managerial jobs
b non managerial jobs
c skilled jo "
101,1558955523713769479,the fresh air and a lost me gt gt gt gt gt gt gt 
102,1558955523705229312,"the decision making done at the time of earthquake of in pakistan is a clear example of a structured decisions
b repetitive decisions
c non progr "
103,1558955518693081088, challo 
104,1558955491748978689,trent from never have i ever is so fucking funny 
105,1558955412480737280,"in a nation of frightened dullards there is a sorry shortage of outlaws and those few who make the grade are always welcome
hunter s thompson"
106,1558955406550093826, sunty jain
107,1558955404641857536, the reason behind this is just like forced diversity there are sjws who will take any representation given to them 
108,1558955372471271424, good night 
109,1558955368029511682,damnnn boy 
110,1558955361939427330,bitch for the greater good 
111,1558955336995946498, i replied to the other person 
112,1558955316355670017, youre savage 
113,1558955316263395328,top story no comments see more 
114,1558955287318564865, time to point fingers at each other 
115,1558955283992514562, oho i thought you understand urdu btw i just ask when you join mediavine the rpm is same or it goes up as the time pass 
116,1558955281761067011," let me tell you all bird app ppl the only loyal and caring friend of taylor is joseph just him
turner and monte are loyal to leftovers which is great but kyle michael brittany r snakes idk why people can not see that michael literally used tay story last week in his speech"
117,1558955273691316225, best country in africa btw 
118,1558955270750932992, reasons why mlm companiesfail 
119,1558955257216081921, suppressed opponents and organization from gatherings 
120,1558955240560418817, imperfect caption without giving the name
121,1558955236118724608, right
122,1558955230275985413, i prefer writing it in my diary may be if you have very close friends who can listen with an intent to help you only than you should be messaging them 
123,1558955230146035712,hitler blindfolded the german nation with the following tactics which leads to destruction inflamed national pride created fanaticism in the nation by making a group a target of hatred fire with speeches systematic use of propaganda 
124,1558955229302980608,a teflon slacker 
125,1558955217361715200, green
126,1558955185686413316, congratulations 
127,1558955179986255872,former us president donald trump demands returns of documents seized in fbiraid 
128,1558955173988499458, come on family irrespective of his innocence he is the chief of staff of 
129,1558955169609555977, happy indepedence day to india
130,1558955159639756805,no party has the right to hide its funds from the public fawad said 
131,1558955131953381376, all of them suck the predator looks ass 
132,1558955119194112000, inshaallah and we shall beat us interference 
133,1558955103952011266, i have sviper
134,1558955095190036480, he was not a secretary back in either 
135,1558955073543311366, true
136,1558955046682955787,its time to take a step towards sleeping pills
137,1558955044279648260, happy independence day beta 
138,1558955031872905218, yess the editing was nasty on this one 
139,1558954982795350020,jennifer lopez amp ben afflecks daughter violet in nyc photos 
140,1558954981037834242, good job
141,1558954973815357441,"amen
thank you jesus christ "
142,1558954962264080385,hey jotaro i am talking to you are you ignoring me 
143,1558954958644469760,funniest cats via 
144,1558954954932604929,good morning developers one reaction for all the time and yours 
145,1558954951254196224, i cant even trust the process now pichle saalon se yehi karhi hun i have no hope k i will receive the same love i have given 
146,1558954949672837120, lolzzzz
147,1558954889874636805, where r u from btw 
148,1558954864193032199, well morals became the reality do not they i mean just look at the history the moral of the two nation theory and a separate nation for muslims of the sub continent the hardship and the will to work to safeguard what we believe in the fight against all evil and tyranny 
149,1558954848833470464, thats rare and youre lucky mashaaallah hope it stays like this forever for you ameen 
150,1558954837626261504, send please thanks 
151,1558954832861532162, sure my dear 
152,1558954824963694592, happy birthday beta 
153,1558954824481341440, lanat beshumar in donu par
154,1558954819934625792, i love doing things w u also ily
155,1558954818215051264, well deserved
156,1558954790696140800, very good
157,1558954789064491008, phir hum best friends hai naaa 
158,1558954761319333889,well done qaiser 
159,1558954746148524033,anyone watched channel india if not them please watch it on channel catch up as i have often said quaid e azam wanted separate homeland for muslims bcz of the events in europe ie holocaust nehru had an affair with edwina amp had access to top secret documents
160,1558954734463209473, it will be
161,1558954682655145984,true culprits of pakistan 
162,1558954677944717312, i have no
163,1558954658621792256,hahaha rocked 
164,1558954626933821443,happy independence day dear indians and my sidhu fans 
165,1558954625826316288,two of blind mystic baba vangas prophecies for have come true heres what else she predicted 
166,1558954611918209027,it will and should not be for pmln but for pakistan 
167,1558954602162229253, not on
168,1558954593043750912, wadiz for a reason
169,1558954582562295818, i see a murad saeed in him 
170,1558954581773664256, yes no doubt
171,1558954575247409152, exactly was the above a jalsa where just anything goes national image is sadly in the hands of the current govt they should leave their kitty party mindsets at home go to in the video below to understand the difference cheers 
172,1558954572588138496, thanks brother 
173,1558954558176600069, i am also
174,1558954556813463554, agree with the post 
175,1558954555785748480,liberty roundabout on night of august is neverrr not jam packed 
176,1558954501977128960, best picture
177,1558954495069011969, jet with sonic barrier reach he should not give importance to such unworthy incompetent sycophants 
178,1558954472604319744,i dont party bc ain shit to celebrate rn ian rich yet
179,1558954466480635911, you know well that you are fighting a losing battle
180,1558954460063449088,had a interview with inshallah we will lead our country to haqeeqi azaadi 
181,1558954455709663239, yes nd u 
182,1558954442350804993, ready do it
183,1558954433668587521, have fun 
184,1558954417876975617,freshwater sponge aquarium filter and ideal biotope companion 
185,1558954416350322689,pay what you want for lifetime access to aws e books and possibly win aprize 
186,1558954414152499202, made sm memories i love these photos
187,1558954397987749890, beautiful
188,1558954395441692672, congrats bro you proved me wrong
189,1558954388940460032, yeah just because of the dopamine rush in body 
190,1558954376110252033,i was in a death situation so iguess i look at shit different from others
191,1558954367855853576,when does only murders in the building season episode premiere on hulu exploreddetails 
192,1558954348067098624, nice dp 
193,1558954341981384705, happy independence day 
194,1558954337958772744,congratulations amp for presidents police medal 
195,1558954334997696518, done
196,1558954330925023234, thanks for the compliment 
197,1558954327443652608,fauj k agianst hai ya means raw agent fake id block and unfollow 
198,1558954310163103746, nice
199,1558954301787148288, anne waah
200,1558954299744550914,machine gun kelly
201,1558954283399352320, ahan
202,1558954269654614017,woh bus moonis elahi was feeling horny like a bitch aur pass sirf ig sahb hi kharay thay 
203,1558954221646512130, how was your experience working with this qureshi phsycopath 
204,1558954219893293056, ahan
205,1558954199697825794, so beautiful 
206,1558954197613248512,started to prioritize myself and suddenly a lot of people hate me now
207,1558954173772795904, please notice this 
208,1558954144634810368, said the coward who can not even reveal his name 
209,1558954139400523776, sir you are awesome
210,1558954132509458434,prolonged onerous duties overworked yet underpaid 
211,1558954099928084480, keep shut your mouth
212,1558954090125840384, ye to saleem safi ka first cousin he
213,1558954076984991747,taliban violently disperse protesting women in kabul if taliban are not intelligent enough to deal with a small group of women peacefully how their legitimacy as rulers will be established pakistan world power manifesto 
214,1558954070005645312,watch prologue link here 
215,1558954055938019330,cheating is a choice same as loyalty make sure your choices do not bruise your conscience 
216,1558954039089549312, steve mcrae is racist he says hey you black man can you make a video for me then laughs about electrical wires to the man is nipples amp a noose a noose on his neck he finishes stating he loves stuff like that here the video 
217,1558954001374351360, steve mcrae is an anti semite he uses the word shekel historical judean israeli current israeli currency as a synonym of dirty corrupting money to avoid those connotations shekel has been replaced with coin in biblical passages silver coins 
218,1558953994227273728, pity both fell to lowest level in disgracing each other badly exposed themselves may they had known that one who avoided could be better placed but continued spitting at each other amp darkened own faces may allah have mercy on hold ur horses 
219,1558953988271259648, ma sha allah always a pleasure listening to your analysis
220,1558953973054332928,i made more than a million dollars since mostly from my digital agency and e commerce businesses and after all these years one thing i learned is that handling money is not the same as earning money download the book for free from here 
221,1558953969203953664,currently situation of lahore 
222,1558953926409469953, okay then do not bother asking strangers if u have already decided stuff
223,1558953915265302531, cool 
224,1558953910252933122, it is just a joke bro why are you taking it so seriously 
225,1558953907367211008, the crown manifest jane the virgin
226,1558953897267437575, damnnnn mind blowing 
227,1558953885665992710, no idea what hes up to 
228,1558953884135079940, this one spin change the whole gsme 
229,1558953834164224002, weverse translation thou 
230,1558953823389057025, i did that to india but now i play against india and make them score in overs by bowling wides then i chase it down it is far more satisfying 
231,1558953789595430912, i cant talk on his behalf hes never been my colleague either this was one time transmission that he co hosted with me 
232,1558953776744206341,adeles hello songs of remembrance npr 
233,1558953758457053184,i am gonna treat you better 
234,1558953758129733632, enjoy dear
235,1558953733383503874, dw about that i have a friend who can make it happen
236,1558953720108515330, why to choose cotton when silk is available shib
237,1558953719127048198, happy birthday 
238,1558953719106048001,just learned about juventus scandal
239,1558953707907186688, some very loyal mature friends i am sure that woman isnt frankly worth your time 
240,1558953697773748225, to kya howa at least you are safe so enjoy your life and stop using tweeter we do not need your research it is adding nothing in the wellbeing of society 
241,1558953696074993664, say about editing 
242,1558953677918011392, ahan
243,1558953664416473089,neelam muneer leaves fans in awe with newphotoshoot 
244,1558953612641910784, a corrupt general promoting corruption every where 
245,1558953583558770690, do you have anything else to say or are you a bot 
246,1558953529519222784, i could excuse that dress if it was not for blatantly sexualizing her as a seductress after all americans and westerners know little about authentic chinese dresses they probably just saw it in movies and went with it 
247,1558953517494288384, cute
248,1558953482090053632, ahan
249,1558953452268621825, as salam alaikum host amp fm listeners karachi mein independence day kee celebrations kesy public ne enjoy ke 
250,1558953450263777280,courage got poisoning a day before i wore pakistani cotton shalwar by time i reached vet it was torn i felt so embarrassed but did not go home to change so i tied a dupata i had around me frm now onwards only pants when taking dogs out traditional dress is not durable
251,1558953442521251840, or even trip and fall mr joestar your body will suffer damage several times my own 
252,1558953411973881867, 
253,1558953404189261827, ap bhe start sir 
254,1558953386371842051, talented log
255,1558953373226901505, if it was some ordinary account these responses might just have been fun but unnecessary banter by verified official accounts lol 
256,1558953366834843648, the biggest munafiq ahmed qureshi is kashmir is occupied while all honky dory with israel the bigger oppressor 
257,1558953340960137221, much enough for all 
258,1558953331946655749, barking dogs seldom bite leave it
259,1558953327441887234," lets goooooooooooooooooooooooooooooooooooo
come with eth and still get rejected by us "
260,1558953319455940610, point 
261,1558953300506005504,pakistan has been going through rough change amp no one other than imran saab is more capable to get things better because it is courage to speak praise of india given india is our biggest enemy he says what is out there not what is expected he deserve pakistan is support 
262,1558953297507221504, your highness its not birthday it was freedom for which muslims fought for years 
263,1558953259510939648, cool
264,1558953246990942212,gazprom ramps up gas flows to hungary the expresstribune 
265,1558953243895648257,article link 
266,1558953239952986118,love from istanbul 
267,1558953235515412487,peoples liberation army boasts of increased reach in the skies before taiwan straitcrisis 
268,1558953234378752001,we all fall how we get up is that matters 
269,1558953231635595264, time really flies like no other thing but what has happened to your colleague he has been in hot waters for his controversial opinions and statements p
270,1558953211083489288, masha allah heartiest congratulations well deserved and proud moment for the family 
271,1558953177051013122, but you played really well
272,1558953174656061440, matlab i get where you are coming from but zyada hogya boy 
273,1558953173720731649,there is no electricity since o clock what a shame 
274,1558953132369084417, ahan
275,1558953119123443712, leave her please why wasting your energy on such people is it worthy no so best answer is no answer 
276,1558953113175953414, congratulations may allah bless you more success in life 
277,1558953093710110721, the beat main boss lineup in any fromsoftware game these bosses are much better than anything from bloodborne or 
278,1558953086621728771,grief is strange it comes in waves and all you can do is feel your feelings and just move through it 
279,1558953086101618689,i get why yall be worshipping nicotine
280,1558953059048357889, congratulations one person follow you and one person unfollow you 
281,1558953054346551301,i dont think so its pakistan 
282,1558953019814952961,lol ik has corrupted the minds of his followers they contradict themselves in a single breath but do not get it 
283,1558953012885950464, lolx is sawal ka jawab boys nhi dy sakhty hai u know depand of you
284,1558953007563345920, please do i support
285,1558953005956972544,if ive ever cooked for you i love you
286,1558953004388302848,this single currency both sides explain years of reality that how this state governed and who are behind the state machinery 
287,1558953000596488192,padma lakshmi hoping for swift healing for ex salmanrushdie 
288,1558952993277575169, ahan
289,1558952986906353664, exactly leave it to allah 
290,1558952961748910080, congratulations 
291,1558952959748218881,putting a loved one in a nursing home could cost you as nursing homes sue relatives and friends ofresidents 
292,1558952956178927619, i sleep like that everyday i have maiday problems u too lesgoo
293,1558952955059048449," margit gt godrick gt radhan gt rykard gt morgott gt fire giant mohg malenia gt godskin duo gt maliketh and placidusax gt gideon gt godfrey gt radagon and elden beast
except the fire giant and the duo every boss here is more than reason enough to replay "
294,1558952949019287553,barish
295,1558952946582360064,me and my situations on august 
296,1558952936784412672,legend 
297,1558952902089129987,the exports rankings of pakistan compared to its neighbour country is after years have a look 
298,1558952861945499648, thanks
299,1558952859269570561, omg finally mikasa congratulations so so happy for you 
300,1558952842941140992, ahan
301,1558952830073012224, overflowed several people got trapped in water yesterday of them have been rescued and operation for rescue is underway informed spokesperson of edhi foundation avoid this route 
302,1558952824720932865, love pak army 
303,1558952780060135427, big fat rolls
304,1558952768387547136, many many congratulations brother
305,1558952768219582464, bhai i m really sorry to say but app bohat stupid batain ker rahe hain please try to update your info
306,1558952705904717824, so again we thought that on monday we have economic crisis 
307,1558952704772276225,i didnt lose in my request to be a member of the house of reps bashir reacts toreappointment 
308,1558952669158449153, what have they done good which i might do not know would you please enlighten do not try to play with me about economy and export remittances cards i might know better things about these you are living in pak so be realistic 
309,1558952660342013952, ahan
310,1558952658693660672,happy birthday to the one amp only sir have many many are a gem 
311,1558952656856616962, depends on competition btw ahrefs amp moz have same criteria for authority da dr 
312,1558952641417420802,if you believe your thoughts they become your reality choose them wisely with 
313,1558952614657753090, sleep not found
314,1558952556667207682, willing to trade a couple for lucky trade chances registered shiny trade 
315,1558952534483603462, respect for this man 
316,1558952511675006979, ok i will forward your tweet to your sister 
317,1558952511020666880,it fucking really hard transition from boy to man
318,1558952496764264453, tum khud ho
319,1558952449548976130, mubarak on a truly deserving decoration sukhera sab 
320,1558952434663317505,man taken into custody over death of mother of four killed on a dirtroad 
321,1558952419421065217, and of course created only last month most of all only argues with snyder fans not hard to guess why 
322,1558952369626423298, good morning
323,1558952364815572994, thanks
324,1558952345551216640,time flies this was a year ago 
325,1558952331613556736, what is the genre 
326,1558952324055318528,what a nail biting match going on batting on with sixes trying all the variety of bouncers in swingers out swingers yorkers but imran being namesake hitting everything out of the park 
327,1558952312642609153, great work bro nice prediction it was right on time according to dates you mentioned 
328,1558952273992196097, good morning
329,1558952271290896385, missed a k
330,1558952268208152579, they are exactly like great britian who colonised half the world and united states who are colonising complete world by attacking them
331,1558952257521074178, sir bechare ko usla leader he zalil krwae hwe hen hala ke achw political workers hen yee
332,1558952222469361664, also before we mint bet
333,1558952217738084353, good jobbbbbb
334,1558952206950350848, congrats 
335,1558952206631673857,soap star robyn griggs dies at 
336,1558952198083600384,great leader of pakistan 
337,1558952153976389647, good morning
338,1558952133881470977, congrats 
339,1558952130182279169, which one
340,1558952130169413632, looking for recommendations wuthering heights in pdf format anyone 
341,1558952114088542208,traffic accident in heavy rain in pakistan leaves dead 
342,1558952103019778048, aline the best bravo 
343,1558952093083467776, thank you mr pm
344,1558952089317175296, sorry but warra stupud question
345,1558952089048465412, he is also one of a kind a former subordinate one should be proud of
346,1558952087857283073, looks great
347,1558952064503390208,sometimes you need to be alone so you can be with allah 
348,1558952064222470151, thek hain bs
349,1558952048288075777,yes my face is a problem
350,1558952035126366208, you said the truth that said it is hard to be original with studios breathing down your neck and it is difficult to come up with original ideas for most directors and writers anyway 
351,1558952012154380288,govt private schools to reopen across kptoday 
352,1558952005816799234, fake ha
353,1558952004642283521, no u dont
354,1558952002939396096, gestures are more eloquent than words and yours tell an incredible story i appreciate you dedicating the time you are an example to young people we cannot forget what you have done loads of love and prayers pakistan zindabaad 
355,1558951998602493960, hahahhahah exactly petty things 
356,1558951987080740865, good morning
357,1558951978490892290, sure chk me now
358,1558951975747731459, imran bhai this woman is not worth your replies you are above these petty women 
359,1558951969301094400,italy emerges as european hotspot for west nile fever outbreaks 
360,1558951957867397120, come to just troll you
361,1558951951634780163, aunty triggered 
362,1558951948002500609,starmer vows to extend windfall tax to freeze family fuelbills 
363,1558951944143904768, can i
364,1558951941824303106, maybe booleneator did not teach steb how to use obs or maybe steb was too busy alienating aron ra on the definition of semi hard atheism to learn anything from bool 
365,1558951913563070464, lol still pti did not get thier chief executive do they have not even a single person who is better than this biggest daaku 
366,1558951903819694080, ahan
367,1558951895229779968, have a good day 
368,1558951879832371200, good morning
369,1558951857686548481, agreed to the even bit of the each word
370,1558951851143614464, sea token will destroy ape
371,1558951848916271106,sometimes a hug is worth more than a thousand words 
372,1558951846676516869, ahan
373,1558951845464363010, hahaha imran bhai is fully enjoying
374,1558951834319994881, tere dil wich
375,1558951829282635776,a journey with fun pti crowd on motorway 
376,1558951799331213313, go to wall
377,1558951793794621441,stop fantasising male friends as farishtas
378,1558951793626947586,this note looks more patriotic than all the currency notes combined 
379,1558951793341652992,leaders are like that you will always be in our hearts whether you win or lose you will find us with you 
380,1558951775041880066, well deserved
381,1558951765151780867, love can heal no magic no luck even after posting these many times no one showed interest in last one year am i blindor is it the world around me when i rescued rat i only had rs in bank i almost left him behind butwent back and picked 
382,1558951763272663041, washal
383,1558951761523707904, reply ib pl
384,1558951739193270275, shes in depression give her more medicines 
385,1558951736278138882,a man becomes dangerous when he decides to opt career over girls 
386,1558951723644981249, approach is very different
387,1558951723103838210,yaar wth another one gone forever 
388,1558951723066081282,why do we call all the cats mano who came up with that 
389,1558951721748992000,"position gynaecologist
location sargodha
company khan abdul rehman hospital
visit link to see detailed advertisement "
390,1558951708377681921, army 
391,1558951700685258753, did that to prove your identity in home yet homeless 
392,1558951697363484672,enough to make fun of releasing national songs on independence day instead of ground breaking technological advancements like other countries well pakistan is finally catching up by unveiling its first ever indigenous electric car according to the pak wheel 
393,1558951697300480002,"do not lose hope even in the suffering you are not alone allah swt is with you and allah is not cruel he loves you even in days when it gets harder for you to luv yourself endure it with patience allah swt is enough for you
indeed there is ease with difficulty eshaq"
394,1558951690971320321, august felt so incomplete today did not even see a single house which was decorated w jhandiyan back in time this was the most beautiful ritual of august decorating the house w jhandiyan only to see rain destroy everything the next morning 
395,1558951678400946176, ahan
396,1558951669878120448, fucking one
397,1558951664689844224,the following thread provides insights on partition and it is after effects 
398,1558951664375238656,yes im an overthinker but im also of the time right
399,1558951660529111040,exactly 
400,1558951650387165187, happiest birthday sweetheart 
401,1558951648751456258, this is too much 
402,1558951632406298626, i am in like waiting your gift
