,Tweet Id,Tweet
403,1558951626072793088, good morning
404,1558951613934477314, build your personal brand in the salesforce ecosystem aug register 
405,1558951609685741568,checkout cursortek is in we also have 
406,1558951607479308289,two pakistani soldiers lost their lives and an officer was injured in an exchange of fire with militants in khost a small town in pakistan is province 
407,1558951603582951425, chal acha kr lt
408,1558951593936125953, mine too
409,1558951576340922370, rightt she could have milked the f out of the golden look from the same video 
410,1558951566908030976, thankyouu 
411,1558951551686901762, hunr aram e 
412,1558951526722314245, hahaha i cant confirm this
413,1558951522003812352, dont wanna
414,1558951499824340993,the friend whome i told bachay kaisay hotay hain 
415,1558951483789524993,such a beautiful weather today at village tried to capture this beautiful rainbow visible in the sky making it more beautiful 
416,1558951480035524611,peace 
417,1558951478034702336,black adam may have fought other heroes and i do think superman vs black adam is more interesting but black adam still fights shazam captain marvel more than any other hero and always starts out in his stories in any timeline this is a disservice to adam is mythos 
418,1558951463438766085,indeed women in our society are facing multiple challenges even from birth to death freedom is the first step towards enlightenment 
419,1558951449966612483,i wanna scream my lungs out and tell everyone that the strong misbah they once knew is dead im vulnerable devastated fucked up soul i dont need your fake love or kind words so dont try it 
420,1558951449467527168,get what you like or like what you get just thanks allah for what you have ahsun alvi 
421,1558951448817401857, ahan
422,1558951423643115520, not ttp but someone else has realized that this is a different pakistan 
423,1558951378894323712, todays woman of the match one and only maam azma bokhari 
424,1558951367351455745,putin leaves of his soldiers stranded in tactical withdrawal as ukraine blows up keybridges 
425,1558951364935487488, really
426,1558951364532883459,do not ask the universe for true justice the universe knows everything they did the universe knows everything you did even what you wanted to do pure justice may not go in your favour just ask for forgiveness and mercy 
427,1558951332672901123, mint ki wazir trigger ho gai 
428,1558951315484643328, well we kashmiris wont settle for anything but kashmir before these so called friendly gestures 
429,1558951311667855360, copy n paste ky mahreen hain yeh
430,1558951280944549889,eating french fries alone with others 
431,1558951274590216192, omgggglove uuuu
432,1558951273696722945,app ne yehi sawal kabhi nawaz sharif amp family se pouchay hai please allah ka wasta be honest 
433,1558951247419523075, fuck
434,1558951243220979715, u made each other
435,1558951225168633864,best one 
436,1558951188787302400,if any of these music apps had a dj mixer period life would be better 
437,1558951184207151104,my twitter spaces boss 
438,1558951171062202371, and sell data to microsoft
439,1558951135607754755,south carolina woman dies after being impaled by a beachumbrella 
440,1558951135444074497,happy and blessed pakistan independence day wishes for 
441,1558951117752598528,new bontrager mtb wheels are sub more affordable models are pretty light too 
442,1558951106327216129,cursortek is of and plus 
443,1558951103911395333, wish there wasnt any recovery option just for this specific time
444,1558951071023874056, will cheshliar and manya become huge creators now 
445,1558951036299124736, oh no let him have his fun i insist
446,1558951027881254913,remember those things that trigger you are the things that need healing most 
447,1558951019282927618,going to make once i get the time 
448,1558950998009417730,stay strong 
449,1558950969198747650, respect 
450,1558950940601978880, we will see sarah
451,1558950935031939076, very good
452,1558950914454593538,youth party pakistan ypp 
453,1558950894028349440, well said jani
454,1558950875171024896, treat to watch
455,1558950874269077507, amen
456,1558950866270519297, a big stone on the back side of qau stream wali side listening music and nature 
457,1558950858489995270,when i say good night there is no lie i really fall asleep
458,1558950856665579522, one of my fav anchor 
459,1558950842115538945,will yes he will 
460,1558950827187912705, none of the party follow pure islam then what we should do silent is the answer or join a better party of them 
461,1558950826718027776, man this is not enough just talking tell him to follow this up with some action like onboarding people like yeh tau try bhi nahi karay gay sirf statement daina kafi nahi ab 
462,1558950826609098753,amen 
463,1558950818342383616, how about a twitter block
464,1558950787069485060, amen
465,1558950784796065800, true
466,1558950753183596545, i call it humiliation kink they all have it 
467,1558950746258817024,time to disappear 
468,1558950741561475072,preparing for chemistry test a m 
469,1558950722615611400,aunty is not coming slow 
470,1558950719931224066, absolutely yes 
471,1558950712494661634,please be my permanent happiness 
472,1558950669377277955,big reality check for everyone who supported the vonc 
473,1558950661953392643, imran bhai is having fun
474,1558950651819765760, they are not obligated but if you want us to believe them without checking what they found you are a fool that is why courts release transcripts of cases unless they are sensitive so people are informed and know why the judgement was made 
475,1558950629787172865, they were the perpetrators of worst crimes in human history not the victims certainly today karma is getting back to them when hindu zionists have begun destruction of sikhs they should have listened to qauid e azam in amp joined pakistan along with east punjab 
476,1558950626058506241,i really want to talk to you but i feel like i am disturbing you 
477,1558950620073271297,jamie durie height weight net worth age birthday wikipedia who nationality biography 
478,1558950612242518018, thanks for the entertainment 
479,1558950609700659201, software update 
480,1558950605623885825,your monday briefing u s lawmakers visittaiwan 
481,1558950601475620865,itny arsay sy date p ni gaya i wanna go god please
482,1558950599982448641, super
483,1558950589584867328, ooooo really 
484,1558950563752120320,intelligent people did not talk they displayed ka nishan jeet ka nihsan 
485,1558950560308543488, you are pride of pakistan amp role model for everyone 
486,1558950554700849153,win btc 
487,1558950533137928193, well yes of course it is i was indeed referring to you when i typed it out and replied to you 
488,1558950528893464576, copying his pyo khaptaaaan imrando 
489,1558950528708747265,jashne azadi and happy birthday to my late mother my ami gee ap sath nh tu kuch b acha nh lagta i love u allah ap ku janat may jaga dien its been years ive lost her 
490,1558950526703861761, absolutely ridiculous bs by anthony taylor
491,1558950523482640386,"he is evil look at his face
full of chicanerous thoughts "
492,1558950515068862468, ho he rehy ho dekh rehi ho ma
493,1558950504838881280,i need someone i can talk to all night 
494,1558950503333101568,pakistanis are mentally unstable janwars according to this maid of maryam nawaz 
495,1558950502624362497, sherrrrrr 
496,1558950495137550339, it might have been true before modi came to power
497,1558950468428201990, big six
498,1558950464179281920, lovely poetry like share and comment 
499,1558950461339754496, lovely poetry like share and comment 
500,1558950451600654339, well excuse my reply but since lineage under islamic laws are drawn via tha father n hence it is required to maintain the whole family is data i e the family tree there is no way you can opt out of it despite your uneasiness over the